1,Skaner laserowy do pomiarów scenerii 3D Faro Focus 3D
2,Zestaw do prowadzenia badań Human-Computer- Interaction
3,Eye Tracker SMI RedEye500
4,Stanowisko do badań sygnałów biometrycznych
5,Stanowisko ultraszybkich pomiarów sekwencji obrazów z uwzględnieniem zmian termicznych.
6,Stanowisko wieloprocesorowego systemu klasyfikacji i analizy sygnałów fizycznych czasu rzeczywistego.
7,Stanowisko restytuowania scenerii 3D z wykorzystaniem obrazów interferencyjnych
8,Zespół modułowych kontrolerów przemysłowych w sterowaniu rzeczywistych procesów technologicznych
9,Stanowisko modelowania i generowania siatki w geometrii w warunkach systemu czasu rzeczywistego